{
    "functionCode": "ctbe",
    "clli": "LSLEILAA",
    "inmsList": "",
    "oid": "ctbe0002vm003",
    "_flatironUpdateTimeMs": 1502460520129,
    "source": "/opt/app/cambria/anaidata/process/AnAI_Device.raw-2017081105",
    "uuid": "f0c693e6-a091-4096-9184-bef7af08ede9",
    "network": "CBB",
    "osVersion": "Proprietary",
    "equip_vendor_model": "R202-May27",
    "osType": "Proprietary",
    "alias": "ctbe0002vm003",
    "serviceId": "e433710f-9217-458d-a79d-1c7aff376d89",
    "class": "Device",
    "equipVendor": "Nokia",
    "oamIpv6": "",
    "deviceType": "VM",
    "fqdn": "",
    "entityType": "vserver",
    "transactionTimeStamp": "20170811-14:08:39:599",
    "globalCustomerId": "",
    "customerName": "",
    "transactionId": "76aa9d45-8f0e-4e76-aa60-e311cf33ef2e",
    "isManaged": "true",
    "cdate": "Tue Jun 13 10:37:46 CDT 2017",
    "provStatus": "",
    "mdate": "Fri Aug 11 09:08:40 CDT 2017",
    "communityString": "",
    "service": "VOIP-VUSP",
    "domain": "e2e1",
    "inMaint": "false",
    "name": "ctbe0002vm003"
}